Identifier,Edition Statement,Place of Publication,Date of Publication,Publisher,Title,Author,Contributors,Issuance type,Flickr URL,Shelfmarks
180894,,London,,Richard Bentley,"African Hunting from Natal to the Zambesi including Lake Ngami, the Kalahari Desert, &c. from 1852 to 1860 ... With illustrations [including a portrait] by James Wolf and J. B. Zwecker","BALDWIN, William Charles.","WOLF, James - Artist|ZWECKER, John Baptist.",monographic,http://www.flickr.com/photos/britishlibrary/tags/sysnum000180894,British Library HMNTS 010095.g.6.
181560,,London,1825,"Hurst, Robinson & Co.",The Historical Works of Sir James Balfour ... Published from the original mss. preserved in the library of the Faculty of Advocates. [Edited by James Haig. With a prefatory memoir taken from the Memoria Balfouriana of Sir Robert Sibbald.],"BALFOUR, James - Sir, Bart., of Kinnaird","HAIG, James - of the Advocates Library, Edinburgh|Sibbald, Robert - Sir",monographic,http://www.flickr.com/photos/britishlibrary/tags/sysnum000181560,British Library HMNTS 600.f.4-7.
181975,,London,1853,Chapman & Hall,The Diary of Martha Bethune Baliol from 1753 to 1754. [By Harriet Skene.],"BALIOL, Martha Bethune.","SKENE, Harriet.",monographic,http://www.flickr.com/photos/britishlibrary/tags/sysnum000181975,British Library HMNTS 12627.b.10.
182354,,London,,Published & sold in the Theatre,"Lurline: a grand romantic original opera, in three acts, composed by W. Vincent Wallace, the words by E. Fitzball: first produced at the Royal English Opera, Covent Garden ... February 23rd 1860","BALL, afterwards FITZBALL, Edward.","WALLACE, William Vincent - Musical Composer",monographic,http://www.flickr.com/photos/britishlibrary/tags/sysnum000182354,British Library HMNTS 11781.d.23.(3.)
183576,,London,,"Ward, Lock & Co.",Brave Old Ballads. Illustrated with coloured engravings from drawings by John Gilbert,,"Gilbert, John - Sir",monographic,http://www.flickr.com/photos/britishlibrary/tags/sysnum000183576,British Library HMNTS 11601.ee.8.
186463,,London,1841,John Murray,"A Residence on the Shores of the Baltic. Described in a series of letters. [By Elizabeth Rigby, afterwards Lady Eastlake.]",,"RIGBY, Elizabeth - afterwards EASTLAKE (Elizabeth) Lady",monographic,http://www.flickr.com/photos/britishlibrary/tags/sysnum000186463,British Library HMNTS 791.i.9.
186464,"Another edition. Letters from the Shores of the Baltic. Second edition, with twenty etchings. By Elizabeth Rigby, afterwards Lady Eastlake.",London,1842,John Murray,"[A Residence on the Shores of the Baltic. Described in a series of letters. [By Elizabeth Rigby, afterwards Lady Eastlake.]]",,"RIGBY, Elizabeth - afterwards EASTLAKE (Elizabeth) Lady",monographic,http://www.flickr.com/photos/britishlibrary/tags/sysnum000186464,British Library HMNTS 10106.df.15.
189368,,London,1825,Longman & Co.,"Excursions from Bandon, in the South of Ireland. By a plain Englishman [i.e. Thomas Sheahan]",,"SHEAHAN, Thomas.",monographic,http://www.flickr.com/photos/britishlibrary/tags/sysnum000189368,British Library HMNTS 792.c.32.(1.)
189612,,London,1843,"Smith, Elder & Co.","Summer Excursions in the neighbourhood of Banff, and vicinity of Duff-House, Bridge of Alva, &c. &c. By a Deveronside poet [i.e. Alexander Harper. In verse]. To which are appended some notices of the works of art in Duff-House. [With plates and a map.]",,"HARPER, Alexander - Poetical Writer",monographic,http://www.flickr.com/photos/britishlibrary/tags/sysnum000189612,British Library HMNTS 1466.f.2.
190876,,London,1731,W. Meadows; S. Billingsley,The Fall of the Earl of Essex ... Alter'd [by James Ralph] from the Unhappy Favourite of Mr. Banks. [In verse.],"BANKS, John - Dramatic Writer","RALPH, James - Miscellaneous Writer",monographic,http://www.flickr.com/photos/britishlibrary/tags/sysnum000190876,British Library HMNTS 642.h.28.(2.)
191424,,London,1877,Sampson Low & Co.,Africa and the Brussels Geographical Conference ... Translated by R. H. Major ... With a map,"BANNING, Emile.|BANNISTER, John - LL.D","MAJOR, Ralph Hermon.",monographic,http://www.flickr.com/photos/britishlibrary/tags/sysnum000191424,British Library HMNTS 10096.bbb.25.
192659,,London,1891,Henry Frowde,"The Vision of Barabbas, and other poems. [By John Joseph Brown.]",,"BROWN, John Joseph.",monographic,http://www.flickr.com/photos/britishlibrary/tags/sysnum000192659,British Library HMNTS 11651.g.41.
193941,,London,1874,Samuel Tinsley,"Barbara's Warning. A novel. By the author of “Recommended to Mercy” [i.e. Matilda C. Houstoun], etc",,"HOUSTOUN, Matilda Charlotte.",monographic,http://www.flickr.com/photos/britishlibrary/tags/sysnum000193941,British Library HMNTS 12631.n.3.
193942,,London,,J. & R. Maxwell,"The Story of Barbara; her splendid misery, and her gilded cage. A novel. By the author of “Lady Audley's Secret” [i.e. Mary E. Braddon]",,"Braddon, M. E. (Mary Elizabeth)",monographic,http://www.flickr.com/photos/britishlibrary/tags/sysnum000193942,British Library HMNTS 12640.g.8.
194186,,London,,"Charles Corbett, etc","A Voyage to Barbary, for the Redemption of Captives; performed, in 1720, by the Mathurin-Trinitarian Fathers, Fran, Comelin, Philemon de la Motte, and Jos. Bernard. Now first Englished [by J. Morgan] from the French original [of P. de La Motte]. With lists of ... slaves ransomed ... from Mequeniz: also very exact draughts of that place, Alcasar, Oran, and its neighbourhood, with maps, etc: [Voyage pour la redemption des captifs, aux royaumes d'Alger et de Tunis.]",,"BERNARD, Joseph - Abbé",monographic,http://www.flickr.com/photos/britishlibrary/tags/sysnum000194186,British Library HMNTS 1047.g.2.
194842,,London,1734,C. Rivington,"Poems on several Occasions. [With a letter from Dean Swift to Lord Orrery, prefixed; and laudatory verses to the author, by Constantia Grierson.]","BARBER, Mary - Writer of Verse","GRIERSON, Constantia - Mrs",monographic,http://www.flickr.com/photos/britishlibrary/tags/sysnum000194842,British Library HMNTS 642.l.3.|British Library HMNTS 77.k.8.
199977,"Another edition. The Ingoldsby Legends ... Edited, with notes introductory and illustrative, by R. H. Dalton Barham. (Annotated edition.).",London,,Richard Bentley,[The Ingoldsby Legends ... Second edition. [First series. With illustrations by George Cruikshank and John Leech.]]: Ingoldsby Legends. Complete Editions,"Ingoldsby, Thomas","BARHAM, Richard Harris Dalton.",monographic,http://www.flickr.com/photos/britishlibrary/tags/sysnum000199977,British Library HMNTS 11650.g.1.
201740,,London,1870,Macmillan & Co.,"Station Life in New Zealand. [With a preface signed: F. N. B., i.e. Sir Frederick N. Broome.]","BARKER, afterwards BROOME, Mary Anne - Lady","B., F. N.|BROOME, Frederick Napier - Sir",monographic,http://www.flickr.com/photos/britishlibrary/tags/sysnum000201740,British Library HMNTS 10491.pp.3.
203445,,London,1846,"Simpkin, Marshall & Co.",Barnard. A modern romance. [By John Stores Smith. In verse.],,"SMITH, John Stores.",monographic,http://www.flickr.com/photos/britishlibrary/tags/sysnum000203445,British Library HMNTS 1466.f.38.