Identifier,Edition Statement,Place of Publication,Date of Publication,Publisher,Title,Author,Contributors,Issuance type,Flickr URL,Shelfmarks
206,,London,,S. Tinsley & Co.,Walter Forbes. [A novel.] By A. A,A. A.,"FORBES, Walter.",monographic,http://www.flickr.com/photos/britishlibrary/tags/sysnum000000206,British Library HMNTS 12641.b.30.
216,,London,1868,Virtue & Co.,"All for Greed. [A novel. The dedication signed: A. A. A., i.e. Marie Pauline Rose, Baroness Blaze de Bury.]","A., A. A.","BLAZE DE BURY, Marie Pauline Rose - Baroness",monographic,http://www.flickr.com/photos/britishlibrary/tags/sysnum000000216,British Library HMNTS 12626.cc.2.
218,,London,1869,"Bradbury, Evans & Co.","Love the Avenger. By the author of “All for Greed.” [The dedication signed: A. A. A., i.e. Marie Pauline Rose, Baroness Blaze de Bury.]","A., A. A.","BLAZE DE BURY, Marie Pauline Rose - Baroness",monographic,http://www.flickr.com/photos/britishlibrary/tags/sysnum000000218,British Library HMNTS 12625.dd.1.
472,,London,1851,James Darling,"Welsh Sketches, chiefly ecclesiastical, to the close of the twelfth century. By the author of “Proposals for Christian Union” (E. S. A. [i.e. Ernest Appleyard])","A., E. S.","Appleyard, Ernest Silvanus.",monographic,http://www.flickr.com/photos/britishlibrary/tags/sysnum000000472,British Library HMNTS 10369.bbb.15.
480,"A new edition, revised, etc.",London,1857,Wertheim & Macintosh,"[The World in which I live, and my place in it. By E. S. A. [i.e. Letitia Willgoss Stone.] Edited by ... J. H. Broome.]","A., E. S.","BROOME, John Henry.",monographic,http://www.flickr.com/photos/britishlibrary/tags/sysnum000000480,British Library HMNTS 9007.d.28.
481,"Fourth edition, revised, etc.",London,1875,William Macintosh,"[The World in which I live, and my place in it. By E. S. A. [i.e. Letitia Willgoss Stone.] Edited by ... J. H. Broome.]","A., E. S.","BROOME, John Henry.",monographic,http://www.flickr.com/photos/britishlibrary/tags/sysnum000000481,British Library HMNTS 9006.ee.10.
519,,London,1872,The Author,Lagonells. By the author of Darmayne (F. E. A. [i.e. Florence Emily Ashley]),"A., F. E.","ASHLEY, Florence Emily.",monographic,http://www.flickr.com/photos/britishlibrary/tags/sysnum000000519,British Library HMNTS 12637.e.3.
874,,London,1676,,"A Warning to the inhabitants of England, and London in particular ... By M. A. [i.e. Mary Adams.]",Remaʿ.,"ADAMS, Mary.",monographic,http://www.flickr.com/photos/britishlibrary/tags/sysnum000000874,British Library HMNTS 11645.bb.42.
1143,,London,1679,,A Satyr against Vertue. (A poem: supposed to be spoken by a Town-Hector. [By John Oldham. The preface signed: T. A.]),"A., T.","OLDHAM, John.",monographic,http://www.flickr.com/photos/britishlibrary/tags/sysnum000001143,British Library HMNTS 11602.ee.10.(2.)
2854,,London,1865,E. Moxon & Co.,"See-Saw; a novel ... Edited [or rather, written] by W. W. Reade","ABATI, Francesco.","READE, William Winwood.",monographic,http://www.flickr.com/photos/britishlibrary/tags/sysnum000002854,British Library HMNTS 12623.bbb.12.
4884,,London,1820,J. Hatchard & Son,"Abdallah; or, The Arabian Martyr: a Christian drama, in three acts. [In verse.] [By Thomas Foster Barham, the Elder.]",,"BARHAM, Thomas Foster - the Elder",monographic,http://www.flickr.com/photos/britishlibrary/tags/sysnum000004884,British Library HMNTS 994.l.1.(7.)
5382,,London,,Punch Office,"The Comic History of England ... With ... coloured etchings, and ... woodcuts, by John Leech","A'BECKETT, Gilbert Abbott.","LEECH, John - Artist",monographic,http://www.flickr.com/photos/britishlibrary/tags/sysnum000005382,British Library HMNTS C.131.d.16.|British Library HMNTS 9505.d.3.
5385,Another edition. Illustrated by John Leech.,London,,"Bradbury, Agnew & Co.","[The comic history of England ... With twenty coloured etchings, and two hundred woodcuts. By John Leech.]","A'BECKETT, Gilbert Abbott.","LEECH, John - Artist",monographic,http://www.flickr.com/photos/britishlibrary/tags/sysnum000005385,British Library HMNTS 9503.f.4.
5389,Another edition.,London,,"Bradbury, Agnew & Co.",[The Comic History of Rome ... Illustrated by John Leech.],"A'BECKETT, Gilbert Abbott.","LEECH, John - Artist",monographic,http://www.flickr.com/photos/britishlibrary/tags/sysnum000005389,British Library HMNTS 9039.i.11.
6036,,London,1805,C. & R. Baldwin,"The Venetian Outlaw, a drama in three acts ... Translated [from the French translation of J. H. D. Zschokke's “Abällino, oder der grosse Bandit”] and adapted to the English stage by R. W. Elliston",,"ELLISTON, Robert William.",monographic,http://www.flickr.com/photos/britishlibrary/tags/sysnum000006036,British Library HMNTS 642.i.25.|British Library HMNTS 164.g.68.
8435,,London,1892,Effingham Wilson & Co.,The Witwatersrand Gold Mines. A true and unvarnished account of their origin and progress ... Translated ... by H. C. Simonsen,"ABRAHAM, Félix - Writer on Mining","SIMONSEN, H. C.",monographic,http://www.flickr.com/photos/britishlibrary/tags/sysnum000008435,British Library HMNTS 7106.b.46.
8440,,London,1894,Effingham Wilson,The New Era of the Goldmining Industry in the Witwatersrand ... Translated from the German by H. C. Simonsen. With an authentic map of the fields,"ABRAHAM, Félix - Writer on Mining","SIMONSEN, H. C.",monographic,http://www.flickr.com/photos/britishlibrary/tags/sysnum000008440,British Library HMNTS 07108.g.6.
13074,,London,1899,W. Thacker & Co.,"A Summer in High Asia: being a record of sport and travel in Baltistan and Ladakh ... With an appendix on Central Asian trade by Capt. S. H. Godfrey ... Illustrated from drawings by the author, photographs, and a map of the route","ADAIR, Frederick Edward Shafto.","GODFREY, Stuart Hill.",monographic,http://www.flickr.com/photos/britishlibrary/tags/sysnum000013074,British Library HMNTS 10077.d.27.|British Library OC V 3030
13364,,London,,"Griffith, Farran & Co.","A Hand-book and History of Sidmouth from the Triassic period up to “Now.” By אדם [Adam, i.e. P. O. Hutchinson]. Illustrated ... With map",,"HUTCHINSON, Peter Orlando.",monographic,http://www.flickr.com/photos/britishlibrary/tags/sysnum000013364,British Library HMNTS 10358.g.35.(4.)|British Library HMNTS 10352.d.32.
14466,,London,,Adams & King,"The Historie of Eald Street, now called Old Street, with memoranda of the Parish of St. Luke and of the Chartreuse",,"KING - Printer, of Goswell Street",monographic,http://www.flickr.com/photos/britishlibrary/tags/sysnum000014466,British Library HMNTS 10352.i.24.
15141,,London,1893,T. Fisher Unwin,The New Egypt. A social sketch. [Edited by J. W. Longsdon.],"ADAMS, Francis William Lauderdale.","LONGSDON, J. W.",monographic,http://www.flickr.com/photos/britishlibrary/tags/sysnum000015141,British Library HMNTS 010096.e.61.
15146,,London,1894,T. Fisher Unwin,Tiberius: a drama ... With introduction by W. M. Rossetti,"ADAMS, Francis William Lauderdale.","ROSSETTI, William Michael.",monographic,http://www.flickr.com/photos/britishlibrary/tags/sysnum000015146,British Library HMNTS 11781.gg.4.
16543,,London,1816,John Murray,"The Narrative of Robert Adams, a sailor, who was wrecked on the Western Coast of Africa, in the year 1810 ... With a map, etc. [Edited by S. Cock.]","Adams, Robert - Sailor","COCK, Simon.",monographic,http://www.flickr.com/photos/britishlibrary/tags/sysnum000016543,British Library HMNTS 983.e.7.|British Library HMNTS 147.e.3.|British Library HMNTS G.2842.
17602,,London,1897,J. Bowden,East End Idylls ... With an introduction by the Hon. and Rev. J. G. Adderley,"Adcock, Arthur St. John","ADDERLEY, James Granville - Hon",monographic,http://www.flickr.com/photos/britishlibrary/tags/sysnum000017602,British Library HMNTS 012625.i.5.
18173,Another edition. With a complete index. With a portrait engraved by Hopewood.,London,1804,Vernor & Hood,"[The Works of the late Right Honourable Joseph Addison, Esq. ... The third edition, etc. [Edited by Thomas Tickell.]]: Works","ADDISON, Joseph - Right Hon","TICKELL, Thomas.",monographic,http://www.flickr.com/photos/britishlibrary/tags/sysnum000018173,British Library HMNTS 12269.d.7.
20960,,London,1853,Addey & Co.,"The Diary and Houres of the Ladye Adolie, a faythfulle childe. 1552. [Edited, or rather written, by Lady C. M. Pepys.]",,"PEPYS, Charlotte Maria - Lady",monographic,http://www.flickr.com/photos/britishlibrary/tags/sysnum000020960,British Library HMNTS 12620.d.7.
21119,,London,1874,Chapman & Hall,"Lays of Modern Oxford, by Adon. Illustrated by M. E. Edwards, F. Lockwood, and the author",,"EDWARDS, Mary Ellen.|LOCKWOOD, Frank - Sir",monographic,http://www.flickr.com/photos/britishlibrary/tags/sysnum000021119,British Library HMNTS 11650.g.9.
21430,,London,1790,J. Johnson,"Adriano; or, the first of June, a poem. By the author of The Village Curate [i.e. James Hurdis]",,"Hurdis, James",monographic,http://www.flickr.com/photos/britishlibrary/tags/sysnum000021430,British Library HMNTS 11632.d.48.(2.)|British Library HMNTS 992.k.27.(3.)|British Library HMNTS 1508/379.(2.)
21782,,London,,J. Johnston,"The Adventures of a Post Captain. By a Naval Officer. [In verse.] With ... engravings, by Mr. Williams",,"WILLIAMS, Samuel - Wood Engraver",monographic,http://www.flickr.com/photos/britishlibrary/tags/sysnum000021782,British Library HMNTS 11642.g.19.
22105,,London,1795,J. Debrett,"The National Advocates, a poem. Affectionately inscribed to the Honourable Thomas Erskine and Vicary Gibbs, Esquire [in praise of their exertions in defence of Thomas Hardy, Horne Tooke and others]. [By William Hayley.]",,"GIBBS, Vicary - Sir",monographic,http://www.flickr.com/photos/britishlibrary/tags/sysnum000022105,British Library HMNTS 644.k.24.(5.)|British Library HMNTS 11641.h.11.(7.)
23565,,London,1877,Chatto & Windus,Prometheus the Fire-giver. An attempted restoration of the lost first part of the Prometheian Trilogy of Æschylus. [By William Cox Bennett.]: Appendix,Aeschylus.,"BENNETT, William Cox.",monographic,http://www.flickr.com/photos/britishlibrary/tags/sysnum000023565,British Library HMNTS 11652.c.8.
24878,,London,,Hodder & Stoughton,"The Children of Africa. Written for all English-speaking children. By ... the author of “The Children of India,” etc. [i.e. A. W. Marston]",,"MARSTON, Annie Wright.",monographic,http://www.flickr.com/photos/britishlibrary/tags/sysnum000024878,British Library HMNTS 10095.e.1.
27797,,London,,William W. Clowes,"Prospectus of an Expedition into the Interior of South Africa from Dalagoa Bay, etc. [By W. D. Cooley.]: General Appendix",,"COOLEY, William Desborough.",monographic,http://www.flickr.com/photos/britishlibrary/tags/sysnum000027797,British Library HMNTS 010096.h.36.
28873,,London,1853,Chapman & Hall,"Agatha's Husband. A novel. By the author of “Olive,” etc. [i.e. D. M. Mulock, afterwards Craik.]",,"Craik, Dinah Maria Mulock",monographic,http://www.flickr.com/photos/britishlibrary/tags/sysnum000028873,British Library HMNTS 12626.e.16.
28876,Another edition. With illustrations by Walter Crane.,London,1875,Macillan & Co.,"[Agatha's Husband. A novel. By the author of “Olive,” etc. [i.e. D. M. Mulock, afterwards Craik.]]",,"CRANE, Walter.|Craik, Dinah Maria Mulock",monographic,http://www.flickr.com/photos/britishlibrary/tags/sysnum000028876,British Library HMNTS 12619.h.27.
29031,,London,1827,William Carpenter,The Age Reviewed: a satire. [In verse. By Robert Montgomery.],,"MONTGOMERY, Robert - Author of “Satan.”",monographic,http://www.flickr.com/photos/britishlibrary/tags/sysnum000029031,British Library HMNTS 992.l.33.
29032,"Second edition, etc.",London,1828,W. C. Wright,[The Age Reviewed: a satire. [In verse. By Robert Montgomery.]],,"MONTGOMERY, Robert - Author of “Satan.”",monographic,http://www.flickr.com/photos/britishlibrary/tags/sysnum000029032,British Library HMNTS 11642.g.36.
29285,,London,1876,Chapman & Hall,Through the Ages. A psychological romance. By the author of “The Honeymoon” [i.e. the Duke de Medina Pomar],,"MEDINA-POMAR, de - Duke",monographic,http://www.flickr.com/photos/britishlibrary/tags/sysnum000029285,British Library HMNTS 12636.dd.5.
31858,,London,1823,G. & W. B. Whittaker,"Ahasuerus, the Wanderer; a dramatic legend [in verse] ... By the author of Sketches in Hindoostan, and other poems [i.e. Thomas Medwin]",,"MEDWIN, Thomas.",monographic,http://www.flickr.com/photos/britishlibrary/tags/sysnum000031858,British Library HMNTS 993.i.1.
33745,,London,1825,Longman & Co.,The Works of Anna Lætitia Barbauld. With a memoir by Lucy Aikin,"AIKIN, afterwards BARBAULD, Anna Laetitia.","Aikin, Lucy",monographic,http://www.flickr.com/photos/britishlibrary/tags/sysnum000033745,British Library HMNTS 994.h.2.|British Library HMNTS G.12828.; G.12829.
33881,"A new edition, with additions and corrections, and a supplement by R. H. Evans.",London,1810,R. H. Evans,[Essays on song-writing: with a collection of such English songs as are most eminent for poetical merit. To which are added some original pieces. [By J. Aikin.]],"AIKIN, John - M.D","EVANS, Robert Harding.",monographic,http://www.flickr.com/photos/britishlibrary/tags/sysnum000033881,British Library HMNTS 11622.c.1.
34463,,London,1872,J. Maxwell & Co.,"Robert Ainsleigh. By the author of 'Lady Audley's Secret,' etc. [i.e. Mary E. Braddon]","AINSLEIGH, Robert.","Braddon, M. E. (Mary Elizabeth)",monographic,http://www.flickr.com/photos/britishlibrary/tags/sysnum000034463,British Library HMNTS 12627.n.1.
34785,,London,,J. Maxwell & Co.,The illustrated universal gazetteer,,"AINSWORTH, William Francis.",monographic,http://www.flickr.com/photos/britishlibrary/tags/sysnum000034785,British Library HMNTS 10003.d.14.
34793,,London,,C. Griffin & Co.,"Wanderings in every Clime; or, voyages, travels, and adventures all round the world ... A sequel to “The Earth delineated with pen and pencil” ... With ... illustrations, etc","AINSWORTH, William Francis.","Doré, Gustave",monographic,http://www.flickr.com/photos/britishlibrary/tags/sysnum000034793,British Library HMNTS 10027.h.8.
34810,,London,1872,Tinsley Bros.,"Boscobel; or, the Royal Oak. A tale of the year 1651 ... Illustrated by J. H. Rimbault","Ainsworth, William Harrison","RIMBAULT, J. H.",monographic,http://www.flickr.com/photos/britishlibrary/tags/sysnum000034810,British Library HMNTS 12630.dd.1.
34826,,London,1861,Chapman & Hall,The Constable of the Tower: an historical romance ... Illustrated by John Gilbert,"Ainsworth, William Harrison","Gilbert, John - Sir",monographic,http://www.flickr.com/photos/britishlibrary/tags/sysnum000034826,British Library HMNTS 12634.g.1.
34852,"New edition, with illustrations by Sir John Gilbert.",London,,G. Routledge & Sons,"[The Flitch of Bacon: or, the Custom of Dunmow. A tale of English home. With illustrations by John Gilbert.]","Ainsworth, William Harrison","Gilbert, John - Sir",monographic,http://www.flickr.com/photos/britishlibrary/tags/sysnum000034852,British Library HMNTS 12620.ee.28.
34914,,London,,G. Routledge & Co.,Mervyn Clitheroe ... Illustrated by Hablot K. Browne,"Ainsworth, William Harrison","BROWNE, Hablot Knight.",monographic,http://www.flickr.com/photos/britishlibrary/tags/sysnum000034914,British Library HMNTS 12620.d.8.
34952,,London,1860,"Routledge, Warne & Routledge",Ovingdean Grange. A tale of the South Downs. Illustrated by Hablot K. Browne,"Ainsworth, William Harrison","BROWNE, Hablot Knight.",monographic,http://www.flickr.com/photos/britishlibrary/tags/sysnum000034952,British Library HMNTS 12621.h.18.
34967,Another edition. With illustrations by John Gilbert.,London,1857,G. Routledge & Co.,[Rookwood ... The fourth edition ... with illustrations by George Cruikshank. [With a portrait.]],"Ainsworth, William Harrison","Gilbert, John - Sir",monographic,http://www.flickr.com/photos/britishlibrary/tags/sysnum000034967,British Library HMNTS 12620.e.8.
34987,,London,,G. Routledge & Co.,The Spendthrift: a tale ... With illustrations by Hablot K. Browne,"Ainsworth, William Harrison","BROWNE, Hablot Knight.",monographic,http://www.flickr.com/photos/britishlibrary/tags/sysnum000034987,British Library HMNTS 12602.g.5.
36231,,London,1878,William Poole,Plimsoll's England. A satire. By Ajax. [In verse.],,"PLIMSOLL, Samuel.",monographic,http://www.flickr.com/photos/britishlibrary/tags/sysnum000036231,British Library HMNTS 11646.g.51.(21.)
36721,,London,1897,Bliss & Sands,"Triscombe Stone: a romance of the Quantock Hills, etc","AKERMAN, Portland Board - and HURST (Norman)","HURST, Norman.",monographic,http://www.flickr.com/photos/britishlibrary/tags/sysnum000036721,British Library HMNTS 012625.f.44.
38986,,London,1827,William Marsh,"Scenes and Occurrences in Albany and Cafferland, South Africa. [By T. Phillips.]",,"PHILLIPS, T. - Rev., Baptist Missionary",monographic,http://www.flickr.com/photos/britishlibrary/tags/sysnum000038986,British Library HMNTS 790.d.17.
39670,,London,1808,T. & R. Hughes,"Albert and Rosalie, or the Fire King. A grand melodrama, in three acts. [By F. F. Warton. In verse.]",,"WARTON, Ferdinand Fullarton.",monographic,http://www.flickr.com/photos/britishlibrary/tags/sysnum000039670,British Library HMNTS 11779.c.23.
40021,,London,1886,Macmillan & Co.,"The Cruise of Her Majesty's Ship “Bacchante,” 1879-1882. Compiled from the private journals, letters and note-books of Prince Albert Victor and Prince George of Wales, with additions by J. N. Dalton",,"DALTON, John Neale.",monographic,http://www.flickr.com/photos/britishlibrary/tags/sysnum000040021,British Library HMNTS 10024.cc.26.
41601,,London,1724,J. Roberts,"Albion; or, the Court of Neptune. A masque. [By Thomas Cooke.]",,"COOKE, Thomas - of Braintree, Essex",monographic,http://www.flickr.com/photos/britishlibrary/tags/sysnum000041601,British Library HMNTS 642.i.5.(1.)
41623,,London,1772,J. Wilkie,The Albion Princess: a pindaric ode. [By Robert Colvill.],,"COLVILL, Robert.",monographic,http://www.flickr.com/photos/britishlibrary/tags/sysnum000041623,British Library HMNTS 11602.gg.29.(11.)
42862,,London,,"James Carpenter, etc.","The Geographical and Historical Dictionary of America and the West Indies, containing an entire translation of the Spanish work of ... A. de Alcedo, with large additions ... by G. A. Thompson","ALCEDO, Antonio de.","THOMPSON, George Alexander.",monographic,http://www.flickr.com/photos/britishlibrary/tags/sysnum000042862,British Library HMNTS 797.dd.2.|British Library HMNTS 146.d.15-19.
42904,,London,1873,"Smith, Elder & Co.",Alcestis. [A novel. By Blanche Warre Cornish.],,"CORNISH, Blanche Warre.",monographic,http://www.flickr.com/photos/britishlibrary/tags/sysnum000042904,British Library HMNTS 12638.d.28.
42911,,London,1851,Richard Bentley,"Spiritual Alchemy; or, Trials turned to Gold. By the Author of “Hearts in Mortmain,” and “Cornelia” [i.e. Margaret Sandbach]",,"SANDBACH, Margaret - Mrs",monographic,http://www.flickr.com/photos/britishlibrary/tags/sysnum000042911,British Library HMNTS 12625.b.11.
43140,,London,1835,Richard Bentley,Recollections of an Excursion to the Monasteries of Alcobaça & Batalha. By the author of Vathek [i.e. W. Beckford. With a portrait],,"Beckford, William",monographic,http://www.flickr.com/photos/britishlibrary/tags/sysnum000043140,British Library HMNTS 1050.g.16.
43252,,London,1799,C. Dilly,"Poems, &c. &c. [Edited by Joanna Hughes.]","ALCOCK, Mary - Poetical Writer","HUGHES, Joanna.",monographic,http://www.flickr.com/photos/britishlibrary/tags/sysnum000043252,British Library HMNTS 994.i.1.|British Library HMNTS RF.2004.a.50
45574,,London,1867,Hurst & Blackett,"Alec's Bride. By the author of “St. Olave's” [i.e. Eliza Tabor, afterwards Stephenson], etc",,"TABOR, afterwards STEPHENSON, Eliza.",monographic,http://www.flickr.com/photos/britishlibrary/tags/sysnum000045574,British Library HMNTS 12625.aaa.1.
48378,,London,1837,Henry Colburn,Narrative of a Voyage of Observation among the Colonies of Western Africa ... and of a campaign in Kaffir-Land ... in 1835 ... Illustrated with maps and plates by Major C. C. Michell,"Alexander, James Edward - Sir","MITCHELL, C. C. - Major",monographic,http://www.flickr.com/photos/britishlibrary/tags/sysnum000048378,British Library HMNTS 1047.k.11.
48384,,London,1830,Henry Colburn & Richard Bentley,"Travels to the Seat of War in the East, through Russia and the Crimea, in 1829, etc. [With plates and a map.]","Alexander, James Edward - Sir|ALEXANDER, John Henry - Engineer","DUCATEL, Julius Timoleon.",monographic,http://www.flickr.com/photos/britishlibrary/tags/sysnum000048384,British Library HMNTS 1048.c.12.|British Library OC T 15504
48908,,London,1841,J. R. Smith,"A Journey to Beresford Hall, the seat of Charles Cotton Esqre, the celebrated author and angler. [Preceded by a memoir of the author. The dedication signed: J. G.]","ALEXANDER, William - Assistant Keeper of Antiquities, British Museum","G., J.",monographic,http://www.flickr.com/photos/britishlibrary/tags/sysnum000048908,British Library HMNTS 10351.g.9.
51064,,London,,Richard Bentley,Through Algeria. By the author of “Life in Tuscany” [i.e. Mabll Sharman Crawford]: Appendix,,"CRAWFORD, Mabel Sharman.",monographic,http://www.flickr.com/photos/britishlibrary/tags/sysnum000051064,British Library HMNTS 10096.c.13.
51125,,London,,Goyder,"Travels in Algeirs, Spain, &c. &c. With a faithful ... account of the Algerines, etc. [By Sophia Barnard.]: Appendix",,"BARNARD, Sophia.",monographic,http://www.flickr.com/photos/britishlibrary/tags/sysnum000051125,British Library HMNTS 10095.g.35.
52316,,London,1883,W. Blackwood & Sons,"Alison. [A novel.] By the author of “Miss Molly,” etc. [i.e. Beatrice May Butt.]",,"BUTT, Beatrice May.",monographic,http://www.flickr.com/photos/britishlibrary/tags/sysnum000052316,British Library HMNTS 12635.u.10.
52859,,London,1807,J. J. Stockdale,"All the Talents' Garland; or, a Few Rockets let off at a celebrated Ministry. [By James Sayers.] ... Second edition",,"SAYERS, James.",monographic,http://www.flickr.com/photos/britishlibrary/tags/sysnum000052859,British Library HMNTS 11643.bbb.16.(1.)
55031,,London,,,The White Man's Foot ... With ... illustrations by J. Finnemore,"Allen, Grant","FINNEMORE, Joseph - Artist",monographic,http://www.flickr.com/photos/britishlibrary/tags/sysnum000055031,British Library HMNTS 012633.k.19.
56969,,London,1829,"I. T. Hinton, Holdworth & Ball",History of the Counties of Surrey and Sussex ... Illustrated by a series of views engraved ... by Nathaniel Whittock,"ALLEN, Thomas - Topographer","WHITTOCK, Nathaniel.",monographic,http://www.flickr.com/photos/britishlibrary/tags/sysnum000056969,British Library HMNTS 10360.s.22.|British Library HMNTS 10353.d.14.
57124,,London,1848,Richard Bentley,"A Narrative of the Expedition sent by Her Majestys Government to the River Niger in 1841, under the command of Capt. H. D. Trotter. [With plates.]","ALLEN, William - Captain, R.N., and THOMSON (Thomas Richard Heywood)","THOMSON, Thomas Richard Heywood.|TROTTER, Henry Dundas.",monographic,http://www.flickr.com/photos/britishlibrary/tags/sysnum000057124,British Library HMNTS 010095.e.46.
58178,,London,1897,Elliot Stock,"Captain Cuellar's Adventures in Connacht & Ulster, A.D. 1588 ... To which is added an introduction and complete translation of Captain Cuellar's Narrative of the Spanish Armada and his adventures in Ireland, by R. Crawford, etc","ALLINGHAM, Hugh.","CRAWFORD, Robert - M.R.I.A|CUELLAR, Franciso de.",monographic,http://www.flickr.com/photos/britishlibrary/tags/sysnum000058178,British Library HMNTS 9508.cc.2.
62084,,London,1814,Longman & Co.,"Alpine Sketches, comprised in a short tour through parts of Holland, Flanders, France, Savoy, Switzerland and Germany, during the summer of 1814. By a Member of the University of Oxford [i.e. George Wilson Bridges]",,"BRIDGES, George Wilson.",monographic,http://www.flickr.com/photos/britishlibrary/tags/sysnum000062084,British Library HMNTS 1049.h.10.
62125,,London,1824,W. Smith,"The Diary of a Traveller over Alps and Appenines; or, Daily minutes of a circuitous excursion. [By Murray Forbes.]",,"FORBES, Murray - Traveller",monographic,http://www.flickr.com/photos/britishlibrary/tags/sysnum000062125,British Library HMNTS 1426.e.11.
62129,,London,,Longmans & Co.,The Maritime Alps and their Seaboard. By the author of “Vera” [i.e. C. L. H. Dempster] ... With illustrations,,"DEMPSTER, Charlotte Louisa Hawkins.",monographic,http://www.flickr.com/photos/britishlibrary/tags/sysnum000062129,British Library HMNTS 10170.f.1.
66142,,London,1803,"T. Cadell and W. Davies, etc.","Amadis de Gaul: a poem in three books; freely translated from the first part of the French version of Nicolas de Heberay [sic], Sieur des Essars; with notes: by William Stewart Rose: Amadis de Gaula (Spanish romance). English. Abridgements. - Book 1",,"ROSE, William Stewart.",monographic,http://www.flickr.com/photos/britishlibrary/tags/sysnum000066142,British Library HMNTS 11641.d.3.
67034,,London,1850,Richard Bentley,"History of the War of the Sicilian Vespers ... [Translated by Anne B. I. Percy.] Edited, with an introduction and notes, by the Earl of Ellesmere","AMARI, Michele.","PERCY, Anne Barbara Isabel.",monographic,http://www.flickr.com/photos/britishlibrary/tags/sysnum000067034,British Library HMNTS 1440.g.14-16.
67200,,London,1818,The Author,"Poems, by an Amateur [i.e. Bernard Barton]",,"BARTON, Bernard.",monographic,http://www.flickr.com/photos/britishlibrary/tags/sysnum000067200,British Library HMNTS 11641.h.1.
68917,,London,1833,Longman & Co.,America and the Americans. By a Citizen of the World [i.e. James Boardman?],,"BOARDMAN, James - of Liverpool",monographic,http://www.flickr.com/photos/britishlibrary/tags/sysnum000068917,British Library HMNTS 792.e.11.
